,,,,,,,,,,,,,Reunion y Colaboracion,,,,,,,Entretenimiento y Cultura,,,,,,,Hogar y espacios personales,,,,,Espacios Comerciales,,,,Hosteleria,,Museos y Parques,,Educacion,,,,,,Oracion y Culto,,,,,Espacios Deportivos,,,Espacios de atencion a la salud,,,Espacios Corporativos,,,,Transporte,,,,Gubernamental,,,
ID,Tipo,Producto,Foto,Marca,Modelo,Descripcion,Cuando_Usar,EVAC,Requiere_Accesorio_o_equipo_Adic,Power_Supply_Adicional,Tapa_Adicional,Caja_Adicional,Escritorio_o_Home_Office,Huddle_Room,Sala_de_Juntas,Auditorio,Salones_Multiples,Congresos__Consejos,Centros_de_Convenciones,Restaurante,RestoBar,Bar__Lounge,Bar_con_Musica_en_Vivo,Discoteca,Teatro,Concierto_Aire_libre,Fiesta_Portatil,Sala_de_Escucha_en_su_casa,Home_Theater,Apartamento_Completo,Casa_Completa,Tienda_o_Boutique,Market,Mall,Centro_Comercial,Hoteles,Resort,Museo,Parques_Tematicos,Educacion_a_Distancia,Salon_de_Clases,Escuela,Colegio,Campus_Universitario,Biblioteca,Capilla,Iglesia,Basilica,Casa_de_Oracion,Centro_de_Oracion,Gimnasio,Coliseo,Estadio,Consultorio,Edificio_Mediano_o_Clinica,Gran_Edificio_u_Hospital,Bodegas,Fabricas,Complex_Oficinas,Gran_Edificio_Oficinas,Aeropuerto_regional,Aeropuerto_nacional,Aeropuerto_internacional,Metro,Edificios_Administrativos,Infraestructura_Tuneles__Puertos,Evacuacion_Ciudades,POR_Definir
1000,Audio,01. Microfono,/Collaborate Versa Lite CT RTP_8.png,ClearOne,Collaborate Versa Lite CT,Microfono Beamforming array con amplificacion y puerto USB Zoom/Teams,En casos que por exigencias arquitectonicas deseen que los microfonos no se vean y que puedan capturar un area muy amplia de manera homogenea.  Este microfono se puede instalar en el techo directamete a su PC,,,PoE,,,,1,1,,,,,,,,,,,,,,,,,,,,,,,,,,,,,,,,,,,,,,,,,,,,,,,,,,,,,
2000,Audio,01. Microfono,/002000_BMA CT_19.png,ClearOne,BMA-360D,Microfono Beamforming array para techo Dante,"En casos que por exigencias arquitectonicas deseen que los microfonos no se vean y que puedan capturar un area muy amplia de manera homogenea.  Este microfono se puede instalar en el techo, en la mesa y en pared",,,PoE,,,,,1,1,1,,,,,,,,,,,,,,,,,,,,,,,,,,,,,,,,,,,,,,,,,,,,,,,,,,,
3000,Audio,01. Microfono,/003000_BMA CTH_19.png,ClearOne,BMA-CTH,Microfono Beamforming array para techo,"En casos que por exigencias arquitectonicas deseen que los microfonos no se vean y que puedan capturar un area muy amplia de manera homogenea.  Este microfono se puede instalar en el techo, en la mesa y en pared",,Converge Huddle,,,,,1,,,,,,,,,,,,,,,,,,,,,,,,,,,,,,,,,,,,,,,,,,,,,,,,,,,,,,
4000,Audio,01. Microfono,/004000_Button Mic_19.png,ClearOne,Button Mic,Microfono miniatura para empotrar en mesa o Drywall,Si requiere un microfono para captar la voz de los participante pero que pase desapercibido ya sea por motivos de seguridad o estetica use este microfono,,,,,,,,1,1,1,,,,,,,,,,,,,,,,,,,,,,,,,,,,,,,,,,,,,,,,,,,,,,,,,,,
5000,Audio,01. Microfono,/005000_Ceiling Mic Array_19.png,ClearOne,Ceiling Mic Array,Microfono de colgar en techos de 3 capsulas en array,"Cuando no se desee tener nada sobre la mesa o sea muy dificil llegar a ella pero requiera captar lo que las personas ubicadas en dicha mesa esten hablando, este es un microfono a tener en cuenta",,,,,,,,1,1,1,,,,,,,,,,,,,,,,,,,,,,,,,,,,,,,,,,,,,,,,,,,,,,,,,,,
6000,Audio,01. Microfono,/006000_Ceiling Mic Array Analogue X_19.png,ClearOne,Ceiling Mic Array Analogue X,Microfono Analogo  de colgar en techos de 3 capsulas en array,"Cuando no se desee tener nada sobre la mesa o sea muy dificil llegar a ella pero requiera captar lo que las personas ubicadas en dicha mesa esten hablando, este es un microfono a tener en cuenta",,Junction Box Incluida,,,,,1,1,1,1,,,,,,,,,,,,,,,,,,,,,,,,,,,,,,,,,,,,,,,,,,,,,,,,,,,
7000,Audio,01. Microfono,/007000_Ceiling Mic Array Dante_19.png,ClearOne,Ceiling Mic Array Dante,Microfono Dante de colgar en techos de 3 capsulas en array,"Opcion con Audio IP x Dante, cuando no se desee tener nada sobre la mesa o sea muy dificil llegar a ella pero requiera captar lo que las personas ubicadas en dicha mesa esten hablando.",,,,,,,,1,1,1,,,,,,,,,,,,,,,,,,,,,,,,,,,,,,,,,,,,,,,,,,,,,,,,,,,
8000,Audio,01. Microfono,/008000_Chat-50.png,ClearOne,Chat-50,Sistema Microfono - Altavoz - Cancelador eco para 1 o 2 personas,"Cuando no desee usar audifonos para una conferencia porque va a estar junto otra persona usted va a requerir un sistema de audio.  Este Chat50 es mas que un speakerphone, es un equipo de audio con procesamiento avanzado de cancelacion de eco en tamaño pequeño para poner en su escritorio y que se integra perfectamente a Spontanea y otras soluciones",,,,,,1,,,,,,,,,,,,,,,,,,,,,,,,,,,,,,,,,,,,,,,,,1,,,,,,,,,,,,,,
9000,Audio,01. Microfono,/009000_Chat-150_19.png,ClearOne,Chat-150,Sistema Microfono - Altavoz - Cancelador eco para 4 o 6 personas,"Cuando van a estar mas de 2 personas en una misma mesa, estas van a requerir un sistema de audio.  Este Chat150 es mas que un speakerphone, es un equipo de audio (parlantes y microfonos) con procesamiento avanzado de cancelacion de eco prioridad de microfonos con captacion de 360° que le garantiza el mejor sonido a la persona con la que ustedes estan reuniendose remotamente.  El Chat150 se integra perfectamente a Spontanea y otras soluciones",,,,,,,1,,,,,,,,,,,,,,,,,,,,,,,,,,,,,,,,,,,,,,,,,,,,,,,,,,,,,,
10000,Audio,01. Microfono,/010000_Chat-Attach_19.png,ClearOne,Chat-Attach,Sistema Microfono - Altavoz - Cancelador eco para 8 o 10 personas,"Cuando van a estar mas de 6 personas en una misma mesa, estas van a requerir un sistema de audio.  Este Chat-Atach es mas que un speakerphone, es un equipo de audio con procesamiento avanzado de cancelacion de eco prioridad de microfonos con captacion de 360° que le garantiza el mejor sonido a la persona con la que ustedes estan reuniendose remotamente.  El ChatAttach se integra perfectamente a Spontanea y otras soluciones",,,,,,,,1,,,,,,,,,,,,,,,,,,,,,,,,,,,,,,,,,,,,,,,,,,,,,,,,,,,,,
10500,Audio,01. Microfono,/Fotos2024_4/DL-USB-360MIC RTP.png,Liberty,DL-USB-360MIC,Microfono de mesa USB 360° de captacion,Cuando necesite captar de 4 a 6 personas sentadas alrededor de una mesa y vaya a complementarlo con unos altavoces externos como la barra IMEO-2 de Audac o los altavoces autoamplificados Ares-5A de Audac o XPAM-530 de DreamSound,,,,,,,1,1,,,,,,,,,,,,,,,,,,,,,,,,,1,,,,,,,,,,,,,,,,,,,,,,,,,,,,
10505,Audio,01. Microfono,/TU-USB-CEILINGMIC2 RTP.png,Liberty,TU-USB-CEILINGMIC2,Set de 2 Microfonos de colgar en techo 360° con interfase USB,En un espacio abierto donde esten de 8 a 16 personas y no desee utilziar espacio de la mesa usando un sistema de captacion de precio muy competitivo con salidad directa USB para Zoom/Teams que se puede integrar con un amplificador o altavoces autopotenciados externos gracias a que incluye interfase con procesamiento y ecualizacion basica,,,,,,,1,1,,,,,,,,,,,,,,,,,,,,,,,,,1,1,,,,,,,,,,,,,,,,,,,,,,,,,,,
10510,Audio,01. Microfono,/Fotos2024_4/DL-USB-360SPKMIC RTP.png,Liberty,DL-USB-360SPKMIC,Sistema Microfono - Altavoz - Cancelador eco para 4 o 6 personas,Cuando van a estar 6 a 8 personas en una misma mesa puede utilizar este sistema que incluye parlantes y microfonos con procesamiento avanzado de cancelacion de eco y captacion de 360° que le garantiza el mejor sonido a la persona con la que ustedes estan reuniendose remotament a travez de Zoom/Teams,,,,,,,1,1,,,,,,,,,,,,,,,,,,,,,,,,,,,,,,,,,,,,,,,,,,,,,,,,,,,,,
11000,Audio,01. Microfono,/Fotos2024_4/Dialog-UVHF 910-6300-001D RTP.png,ClearOne,Dialog-UVHF 910-6300-001D,Receptor Inalambrico Access Point de 8 canales con Dante,"En los casos que requiera manejar 8 microfonos inalambricos de manera simultanea y necesite tener la tranquilidad de poderlos extender hasta 350 sin problemas de interferencias y redundancia de antenas para crecer en captacion este es sistema que debera de escoger.  Si tiene mics inalambricos UVHF, va a necesitar receptor.",,Microfnos inalambricos Dialog UVHF,,,,,,1,1,1,,,,,,,,1,1,,,,,,,,,,,,,,,,,,,,,,,1,1,,1,1,,,,,,,,,,,,,,,
11500,Audio,01. Microfono,/Fotos2024_4/Dialog-UVHF 910-6307-001 RTP.png,ClearOne,Dialog-UVHF 910-6307-001,Microfono inalambrico de superficie cardioide / Omni,Cuando desee un microfono de perfil plano que no se convierta en un obstaculo visual  en su mesa con posibilidad que capte a todos alrededor o solo a los del frente,,Receptor Dialog UVHF,,,,,,1,1,1,,,,,,,,1,,,,,,,,,,,,,,,,,,,,,,,,1,1,,1,1,,,,,,,,,,,,,,,
12000,Audio,01. Microfono,/Fotos2024_4/Dialog-UVHF 910-6308-001 RTP.png,ClearOne,Dialog-UVHF 910-6308-001,Transmisor inalambrico tipo podium para mics cuello de cisne,Cuando se necesite un microfono de cuello de cisne para instalar sobre la mesa pero con las ventajas que sea inalambrico para llegar mas facil a la mesa y hacer una instalacion mas limpia.  Este incluye bateria recargable de larga vida que le ahorrara dinero y le facilitara su montaje.,,Receptor Dialog UVHF,,,,,,1,1,1,1,,,,,,,1,,,,,,,,,,,,,,,,,,,,,,,,1,1,,1,1,,,,,,,,,,,,,,,
12500,Audio,01. Microfono,/Fotos2024_4/Dialog-UVHF 910-6304-006 RTP.png,ClearOne,Dialog-UVHF 910-6304-006,Microfono inalambrico de mano condenser,Cuando se necesite un microfono de Mano con un perfil para conferencistas en donde resalte la claridad de la voz pero con las ventajas que sea inalambrico. Este incluye bateria recargable de larga vida que le ahorrara dinero y le facilitara su montaje.,,Receptor Dialog UVHF,,,,,,1,1,1,1,,,,,,,1,1,,,,,,,,,,,,,,,,,,,,,,,1,1,,1,1,,,,,,,,,,,,,,,
13000,Audio,01. Microfono,/Fotos2024_4/Dialog-UVHF 910-6305-001 RTP.png,ClearOne,Dialog-UVHF 910-6305-001,Transmisor beltpack (viene sin microfono),Cuando use un microfono inalambrico de solapa o de diadema va a necesitar este transmisor que se coloca en su cinturon.  Este transmisor incluye bateria recargable de larga vida que le ahorrara dinero y le facilitara su montaje.  No olvide de incluir los microfonos ya que este es solo el transmisor.,,Receptor Dialog UVHF,,,,,,1,1,1,1,,,,,,,1,,,,,,,,,,,,,,,,,,,,,,,,1,1,,1,1,,,,,,,,,,,,,,,
13500,Audio,01. Microfono,/Fotos2024_4/Dialog-UVHF 910-6004-040 RTP.png,ClearOne,Dialog-UVHF 910-6004-040,Microfono de solapa cardioide para beltpack,"Cuando necesite que el expositor tenga las manos libres pero no desee que se le coloque un microfono de diadema, este microfono que trabaja con el poderoso sistema DS es la solucion",,Beltpack Dialog-UVHF,,,,,,1,1,1,1,,,,,,,1,,,,,,,,,,,,,,,,,,,,,,,,1,1,,1,1,,,,,,,,,,,,,,,
14000,Audio,01. Microfono,/Fotos2024_4/Dialog-UVHF 910-6308-004 RTP.png,ClearOne,Dialog-UVHF 910-6308-004,"Microfono cuello de cisne 18"" para transmisor tipo podium","Cuando necesite que el expositor tenga las manos libres pero no desee que se le coloque un microfono de diadema, este microfono que trabaja con el poderoso sistema DS es la solucion",,Podium Dialog-UVHF,,,,,,1,1,1,1,,,,,,,1,,,,,,,,,,,,,,,,,,,,,,,,1,1,,1,1,,,,,,,,,,,,,,,
14500,Audio,01. Microfono,/Fotos2024_4/Dialog-UVHF 910-6004-020T RTP.png,ClearOne,Dialog-UVHF 910-6004-020T,Microfono de Diadema invisible (1 sola oreja) en Blanco o Negro,"Cuando necesite que el expositor tenga las manos libres y evitar las incomodidades del feedback que pueden generarse con los microfonos de solapa, este microfono de tamaño casi invisible que trabaja con el poderoso sistema DS es la solucion",,Beltpack Dialog-UVHF,,,,,,1,1,1,1,,,,,,,1,,,,,,,,,,,,,,,,,,,,,,,,1,1,,1,1,,,,,,,,,,,,,,,
15000,Audio,01. Microfono,/Diálogo-UVHF 91-6303-001 RTP.png,ClearOne,Dialog-UVHF 910-6303-001,Estacion de recarga para 8 microfonos,Cuando requeira almacenar y cargar facilmente sus microfonos,,,,,,,,1,1,1,1,,,,,,,1,1,,,,,,,,,,,,,,,,,,,,,,,1,1,,1,1,,,,,,,,,,,,,,,
15500,Audio,01. Microfono,/Fotos2024_4/Dialog UVHF 910-6304-001 RTP.png,ClearOne,Dialog UVHF 910-6304-001,Interfase Dante a Analogo y USB,Cuando requiera tener conexión directa de los microofnos a puertos USB y/o salidas analogas,,Receptor Dialog UVHF,,,,,,1,1,1,1,,,,,,,1,1,,,,,,,,,,,,,,,,,,,,,,,1,1,,1,1,,,,,,,,,,,,,,,
18000,Audio,01. Microfono,/Fotos2024_4/Dialog-10 910-6100-010 RTP.png,ClearOne,Dialog-10 910-6100-010,Receptor Inalambrico de 1 canal con puerto salida USB,"En los casos que requiera manejar directamente desde su PC o dispositivo de conferencias Zoom/Teams un  microfono inalambrico.  Si tiene mics inalambricos Dialog10, va a necesitar receptor.",,Microfonos inalámbricos Dialog-10,,,,,1,1,,,,,,,,,,,,,,,,,,,,,,,,,1,1,,,,,,,,,,,,,,,,,,,,,,,,,,,
18100,Audio,01. Microfono,/Fotos2024_4/Dialog-10 910-6101-001 RTP.png,ClearOne,Dialog-10 910-6101-001,Microfono inalambrico de superficie cardioide,Cuando desee un microfono de perfil plano que no se convierta en un obstaculo visual  en su mesa y capte solo a las personas del frente,,Receptor Dialog-10,,,,,1,1,,,,,,,,,,,,,,,,,,,,,,,,,1,1,,,,,,,,,,,,,,,,,,,,,,,,,,,
18200,Audio,01. Microfono,/Fotos2024_4/Dialog-10 910-6101-011 RTP.png,ClearOne,Dialog-10 910-6101-011,Microfono inalambrico de superficie omnidireccional,Cuando desee un microfono de perfil plano que no se convierta en un obstaculo visual  en su mesa y capte a todo su alrededor,,Receptor Dialog-10,,,,,1,1,,,,,,,,,,,,,,,,,,,,,,,,,1,1,,,,,,,,,,,,,,,,,,,,,,,,,,,
18300,Audio,01. Microfono,/Fotos2024_4/Dialog-10 910-6101-181 RTP.png,ClearOne,Dialog-10 910-6101-181,"Microfono inalambrico cuello de cisne 18""",Cuando se necesite un microfono de cuello de cisne para instalar sobre la mesa pero con las ventajas que sea inalambrico para llegar mas facil a la mesa y hacer una instalacion mas limpia.  Este incluye bateria recargable de larga vida que le ahorrara dinero y le facilitara su montaje.,,Receptor Dialog-10,,,,,1,1,,,,,,,,,,,,,,,,,,,,,,,,,1,1,,,,,,,,,,,,,,,,,,,,,,,,,,,
18400,Audio,01. Microfono,/Fotos2024_4/Dialog-10 910-6103-001 RTP.png,ClearOne,Dialog-10 910-6103-001,Microfono inalambrico de mano condenser,Cuando se necesite un microfono de Mano con un perfil para conferencistas en donde resalte la claridad de la voz pero con las ventajas que sea inalambrico. Este incluye bateria recargable de larga vida que le ahorrara dinero y le facilitara su montaje.,,Receptor Dialog-10,,,,,1,1,,,,,,,,,,,,,,,,,,,,,,,,,1,1,,,,,,,,,,,,,,,,,,,,,,,,,,,
18500,Audio,01. Microfono,/Fotos2024_4/Dialog-10 910-6101-004 RTP.png,ClearOne,Dialog-10 910-6101-004,Transmisor beltpack (viene sin microfono),Cuando use un microfono inalambrico de solapa o de diadema va a necesitar este transmisor que se coloca en su cinturon.  Este transmisor incluye bateria recargable de larga vida que le ahorrara dinero y le facilitara su montaje.  No olvide de incluir los microfonos ya que este es solo el transmisor.,,Receptor Dialog-10,,,,,1,1,,,,,,,,,,,,,,,,,,,,,,,,,1,1,,,,,,,,,,,,,,,,,,,,,,,,,,,
18600,Audio,01. Microfono,/Fotos2024_4/Dialog-10 910-6004-040 RTP.png,ClearOne,Dialog-10 910-6004-040,Microfono de solapa cardioide para beltpack,"Cuando necesite que el expositor tenga las manos libres pero no desee que se le coloque un microfono de diadema, este microfono que trabaja con el poderoso sistema DS es la solucion",,Beltpack Dialog-10,,,,,1,1,,,,,,,,,,,,,,,,,,,,,,,,,1,1,,,,,,,,,,,,,,,,,,,,,,,,,,,
18700,Audio,01. Microfono,/Fotos2024_4/Dialog-10 910-6004-020T RTP.png,ClearOne,Dialog-10 910-6004-020T,Microfono de Diadema invisible (1 sola oreja) en Blanco o Negro,"Cuando necesite que el expositor tenga las manos libres y evitar las incomodidades del feedback que pueden generarse con los microfonos de solapa, este microfono de tamaño casi invisible que trabaja con el poderoso sistema DS es la solucion",,Beltpack Dialog-10,,,,,1,1,,,,,,,,,,,,,,,,,,,,,,,,,1,1,,,,,,,,,,,,,,,,,,,,,,,,,,,
18800,Audio,01. Microfono,/Fotos2024_4/Dialog-10 910-6004-400 RTP.png,ClearOne,Dialog-10 910-6004-400,Estacion de recarga para 4 microfonos,Cuando requeira almacenar y cargar facilmente sus microfonos,,,,,,,1,1,,,,,,,,,,,,,,,,,,,,,,,,,1,1,,,,,,,,,,,,,,,,,,,,,,,,,,,
18900,Audio,01. Microfono,/Dialog-10 910-6105-021 RTP.png,ClearOne,Dialog-10 910-6105-021,"Kit extensor de antena de 7,5mts cable RG8",Cuando requiera extender las antenas a un lugar de mejor captacion porque el receptor esta encerrado en un sitio seguro,,Receptor Dialog-10,,,,,1,1,,,,,,,,,,,,,,,,,,,,,,,,,,1,,,,,,,,,,,,,,,,,,,,,,,,,,,
19000,Audio,01. Microfono,/Fotos2024_4/CUB-33 RTP.png,Clock Audio,CUB-33,Microfono de mesa cuello de Ganso USB con boton activacion,"Cuando requeira captar con mucha calidad su voz para ser usada en un streaming o videoconferencia gracias a su conexión directa a Zoom/Teams, puede complementarlo con altavoces externos autoamplificados como los Ares-5A de Audac o XPAM-530 de DreamSound",,,,,,1,1,1,,,,,,,,,,,,,,,,,,,,,,,,,1,1,,,,,,,,,,,,,,,,,,,,,,,,,,,
19020,Audio,01. Microfono,/Fotos2024_4/C-004EW-RF RTP.png,Clock Audio,C-004EW-RF,Microfono de empotrar en mesa unidireccional,"Si desea una captacion muy clara de la voz sin ruidos externos, la idea es acercar el microfono lo mas posible a la persona, asi que un microfono poco intrusivo que capte a las persona sentada al frente de una mesa como este es la solucion ideal funcional y esteticamente.",,,,,,,1,1,1,1,,,,,,,,,,,,,,,,,,,,,,,,,,,,,,,,,,,,,,,,,,,,,,,,,,,
19060,Audio,01. Microfono,/Fotos2024_4/CRM-102-RF RTP.png,Clock Audio,CRM-102-RF,Microfono retractil de empotrar en mesa unidireccional,"Cuando busque un microfono que desaparezca con solo presionarlo cuando no este en uso y ademas una captacion muy clara de la voz sin ruidos externos, la idea es acercar el microfono lo mas posible a la persona, asi que un microfono poco intrusivo que capte a las persona sentada al frente de una mesa como este es la solucion ideal funcional y esteticamente.  Complemente esto con un boton elegante de activacion y tendra lo maximo en elegancia y tecnologia.",,,,,,,1,1,1,1,,,,,,,,,,,,,,,,,,,,,,,,,,,,,,,,,,,,,,,,,,,,,,,,,,,
19100,Audio,01. Microfono,/Fotos2024_4/ARM-102-RF RTP.png,Clock Audio,ARM-102-RF,Microfono retractil motorizado de empotrar en mesa unidireccional,"Cuando busque un microfono que desaparezca automaticamente cuando no este en uso y ademas una captacion muy clara de la voz sin ruidos externos, la idea es acercar el microfono lo mas posible a la persona, asi que un microfono poco intrusivo que capte a las persona sentada al frente de una mesa como este es la solucion ideal funcional y esteticamente.  Complemente esto con un boton elegante de activacion y tendra lo maximo en elegancia y tecnologia.",,ARM-C-MK2,,,,,1,1,1,1,,,,,,,,,,,,,,,,,,,,,,,,,,,,,,,,,,,,,,,,,,,,,,,,,,,
19150,Audio,01. Microfono,/Fotos2024_4/C-007EW RTP.png,Clock Audio,C-007EW,Microfono de techo invisible omnidireccional,Si busca capturar las voces de personas de manera ambiental con un microfono que practicamente desaparezca de la vista se recomeinda el uso de este microfono,,,,,,,1,1,1,1,,,,,,,,,,,,,,,,,,,,,,,,,,,,,,,,,,,,,,,,,,,,,,,,,,,
19200,Audio,01. Microfono,/C-3100W-RF-CP RTP.png,Clock Audio,C-3100W-RF-CP,Microfono de suspender en techo Cardioide,"En casos que no se desee tener microfonos sobre la mesa y se pueda utilizar el techo para instalar un microfono discreto que capte a cada persona adecuadamente, el uso de este microfono le dara muy buenso resultados",,,,,,,1,1,1,1,,,,,,,,,,,,,,,,,,,,,,,1,1,,,,,,,,,,,,,,,,,,,,,,,,,,,
19220,Audio,01. Microfono,/Fotos2024_4/C-8S RTP.png,Clock Audio,C-8S,Microfono de suspender en techo Hypercardioide,"En casos que no se desee tener microfonos sobre la mesa y se pueda utilizar el techo para instalar un microfono discreto que capte con mayor precision a cada persona adecuadamente, el uso de este microfono le dara muy buenso resultados",,,,,,,1,1,1,1,,,,,,,,,,,,,,,,,,,,,,,1,1,,,,,,,,,,,,,,,,,,,,,,,,,,,
19300,Audio,01. Microfono,/Fotos2024_4/C-303-RF RTP.png,Clock Audio,C-303-RF,Microfono de colgar en techo 360°,"Cuando no se desee tener nada sobre la mesa o sea muy dificil llegar a ella pero requiera captarlo que esten hablando un grupo de personas ubicadas en el espacio, este es un microfono a tener en cuenta",,,,,,,1,1,1,1,,,,,,,,,,,,,,,,,,,,,,,1,1,,,,,,,,,,,,,,,,,,,,,,,,,,,
19350,Audio,01. Microfono,/Fotos2024_4/CCRM-4000_C303-RF RTP.png,Clock Audio,CCRM-4000_C303-RF,Microfono de colgar en techo Motorizado 360°,"Cuando tenga una sala de estetica mayuscula en donde no se desee tener nada sobre la mesa y que el microfono en el techo desaparezca cuando no se este usando pero captando muy bien lo que un grupo de personas este hablando en el espacio, este es un microfono a tener en cuenta que combina tecnologia y estetica.",,ARM-C-MK2,,,,,1,1,1,1,,,,,,,,,,,,,,,,,,,,,,,,,,,,,,,,,,,,,,,,,,,,,,,,,,,
20000,,,,,MAS-A100,,,,,,,,,,,,,,,,,,,,,,,,,,,,,,,,,,,,,,,,,,,,,,,,,,,,,,,,,,,,,,,
21000,Audio,01. Microfono,/021000_DDialog-20 Tx OM3.png,ClearOne,Dialog-20 Tx OM3,"Microfono inalambrico de mano dinamico 2,4GHz",Cuando se necesite un microfono de Mano con un perfil para cantantes pero con las ventajas que sea inalambrico. Este incluye bateria recargable de larga vida que le ahorrara dinero y le facilitara su montaje.,,Receptor Dialog-20,,,,,,1,1,1,,,,,,,,1,1,,,,,,,,,,,,,,,,,,,,,,,1,1,,1,1,,,,,,,,,,,,,,,
22000,Audio,01. Microfono,/022000_Dialog-20 Tx H18.png,ClearOne,Dialog-20 Tx H18,"Microfono inalambrico de mano condenser 2,4GHz",Cuando se necesite un microfono de Mano con un perfil para conferencistas en donde resalte la claridad de la voz pero con las ventajas que sea inalambrico. Este incluye bateria recargable de larga vida que le ahorrara dinero y le facilitara su montaje.,,Receptor Dialog-20,,,,,,1,1,1,1,,,,,,,1,1,,,,,,,,,,,,,,,,,,,,,,,1,1,,1,1,,,,,,,,,,,,,,,
23000,Audio,01. Microfono,/023000_Dialog-20 Goose 18.png,ClearOne,Dialog-20 Goose 18,"Microfono inalambrico cuello de cisne 18"" 2,4GHz",Cuando se necesite un microfono de cuello de cisne para instalar sobre la mesa pero con las ventajas que sea inalambrico para llegar mas facil a la mesa y hacer una instalacion mas limpia.  Este incluye bateria recargable de larga vida que le ahorrara dinero y le facilitara su montaje.,,Receptor Dialog-20,,,,,,1,1,1,1,,,,,,,1,,,,,,,,,,,,,,,,,,,,,,,,1,1,,1,1,,,,,,,,,,,,,,,
24000,Audio,01. Microfono,/024000_Dialog-20 Beltpack.png,ClearOne,Dialog-20 Beltpack,"Transmisor Beltpack (viene sin microfono) 2,4GHz",Cuando use un microfono inalambrico de solapa o de diadema va a necesitar este transmisor que se coloca en su cinturon.  Este transmisor incluye bateria recargable de larga vida que le ahorrara dinero y le facilitara su montaje.  No olvide de incluir los microfonos ya que este es solo el transmisor.,,Receptor Dialog-20  Microfonos SWT10L / SWT74W,,,,,,1,1,1,1,,,,,,,1,,,,,,,,,,,,,,,,,,,,,,,,1,1,,1,1,,,,,,,,,,,,,,,
25000,Audio,01. Microfono,/025000_Dialog-20 Receiver.png,ClearOne,Dialog-20 Receiver,"Receptor Inalambrico de 2 canales 2,4GHz","En los casos que requiera manejar 2 microfonos inalambricos de manera simultanea.  Si tiene mics inalambricos Dialog, va a necesitar receptor.",,Microfonos Inalambricos  Dialog & Cargador de Bateria,PoE Opcional,,,,,1,1,1,1,,,,,,,1,1,,,,,,,,,,,,,,,,,,,,,,,1,1,,1,1,,,,,,,,,,,,,,,
26000,Audio,01. Microfono,/026000_SWT10L.png,ClearOne,SWT10L,Microfono de Solapa,"Cuando necesite que el expositor tenga las manos libres pero no desee que se le coloque un microfono de diadema, este microfono que trabaja con el poderoso sistema DS es la solucion",,Transmisor DS-80T,,,,,,1,1,1,1,,,,,,,1,,,,,,,,,,,,,,,,,,,,,,,,,,,1,1,,,,,,,,,,,,,,,
27000,Audio,01. Microfono,/027000_SWT74W.png,ClearOne,SWT74W,Microfono de Diadema invisible (1 sola oreja) en Blanco o Negro,"Cuando necesite que el expositor tenga las manos libres y evitar las incomodidades del feedback que pueden generarse con los microfonos de solapa, este microfono de tamaño casi invisible que trabaja con el poderoso sistema DS es la solucion",,Transmisor DS-80T,,,,,,1,1,1,1,,,,,,,1,,,,,,,,,,,,,,,,,,,,,,,,,,,1,1,,,,,,,,,,,,,,,
28000,Audio,01. Microfono,/028000_635A.png,ClearOne,Tabletop Mic,Microfono de superficie individual,Cuando desee un microfono de perfil plano que no se convierta en un obstaculo visual  en su mesa,,,,,,,,1,1,1,,,,,,,,,,,,,,,,,,,,,,,,,,,,,,,,,,,,,,,,,,,,,,,,,,,
29000,Audio,01. Microfono,/029000_Tabletop Mic.png,EV,635A,Microfono Entrevistas,"Si requiere un microfono discreto de captacion omnidireccional para lograr entrevistas que capten el ambiente y no se vean muy afectadas por el viento o movimientos de la cabeza de los entrevistados, este es el microfono ideal es pecialmetne para ambientes broadcast, no de refuerzo sonoro en vivo.",,,,,,,,,,,,,,,,,,,,,,,,,,,,,,,,,,,,,,,,,,,,,1,1,,,,,,,,,,,,,,,
30000,Audio,01. Microfono,/030000_ND-44.png,EV,ND-44,"Microfono Premium Toms, redoblante e instrumentos",Si necesita captar con excelente calidad instrumetnos de percusion o de cuerdas que requieran precision en su direccionamiento fisico este es el microfono ideal,,,,,,,,,,,,,,,,1,,1,1,,,,,,,,,,,,,,,,,,,,,,,1,1,,,,,,,,,,,,,,,,,,
31000,Audio,01. Microfono,/031000_ND-46.png,EV,ND-46,Microfono Premium para instrumentos supercardioide,Cuando ademas de una gran calidad en la captacion de instrumentos requiere que el microfono tenga un alto rechazo a los ruidos provenientes de otras fuentes o instrumento musicales,,,,,,,,,,,,,,,,1,,1,1,,,,,,,,,,,,,,,,,,,,,,,1,1,,,,,,,,,,,,,,,,,,
32000,Audio,01. Microfono,/032000_ND-66.png,EV,ND-66,Microfono Premium Overhead,"Si necesita un microfono de condensador de alta sensibilidad que le permita captar el sonido de los platillos de una bateria, violines y otros instrumentos de detalle use este microfono",,,,,,,,,,,,,,,,1,,1,1,,,,,,,,,,,,,,,,,,,,,,,1,1,,,,,,,,,,,,,,,,,,
33000,Audio,01. Microfono,/033000_ND-68.png,EV,ND-68,Microfono Premium Bombo,El bombo de una bateria es un instumento especial de alta presion sonora y frecuencias bajas que requieren un click para darle mayor detalle y alli necesitara de un microfono como este que es especializado para este trabajo,,,,,,,,,,,,,,,,1,,1,1,,,,,,,,,,,,,,,,,,,,,,,1,1,,,,,,,,,,,,,,,,,,
