486000,Audio,19. Accesorio Audio,/486000_23850.png,Konig & Meyer,23850,Brazo ecualizable para microfono de estudio en mesa,Cuando requiera tener la agilidad de poder mover el microfono que tenga instalado en una mesa de manera simple y colocarlo en casi cualqueir posicion de manera que se acomode mejor al espacio y obstaculos que encontraria,,,,,,,,,,,,,,,,,,,,,,,,,,,,,,,,,1,,,,,,,,,,,,,,,,,,,,,,,,,,,,
487000,Audio,19. Accesorio Audio,/487000_29376.png,Konig & Meyer,29376,Base para colocar microfono cuello de ganso en mesa,Cuando tenga un microfono cuello de ganso que venga sin base y no desee perforar el podium o mesa para su instalacion,,,,,,,,1,1,1,,1,,,,,,,,,,,,,1,1,,1,1,1,1,1,,,1,1,1,1,1,1,,,,,,,,1,1,1,1,1,1,1,,,1,1,,,
488000,Audio,19. Accesorio Audio,/488000_16080-000-55.png,Konig & Meyer,16080-000-55,Accesorio para soportar audifonos de base microfono,"Si esta usando audifonos y desea tener un punto para colocarlos en los momentos que no los usa y poderlos tomar agilmente en los momentos que los necesite, este soporte que se pega de una base de microfono tripode es un accesorio ideal",,,,,,,,,,,,,,,,1,1,1,1,,,,,,,,,,,,,,1,,,,,,,,,,,,1,1,,,,,,,,,,,,,,,
489000,Audio,19. Accesorio Audio,/489000_23956-000-55.png,Konig & Meyer,23956-000-55,Filtro Anti-Pop para Microfono,"Cuando desee que el microfono que esta usando tenga un filtro que lo proteja de los vientos vocales que producen las letras como la P, T, B, etc, que hacen pequeñas explosiones que alteran y molestan en detalles finos de grabacion o reproduccion de detalle, el filtro antipop es una inversion que le permitira perfeccionar su sistema",,,,,,,,,,,,,,,,,,,,,,,,,,,,,,,,,1,,,,,,,,,,,,,,,,,,,,,,,,,,,,
490000,Audio,19. Accesorio Audio,/490000_25400-500-55.png,Konig & Meyer,25400-500-55,Soporte tripode de microfono para piso con Boom extensible,"Si requiere de una base de piso para instalar el microfono que sea muy resistente y facil de cuadrar para el usuario, esta base 100% Alemana a un precio comodo es la mejor alternativa del mercado.",,,,,,,,,1,1,,,,,,1,,1,1,,,,,,,,,,,,,,,,,,,,1,1,1,1,1,,1,1,,,,,,,,,,,,,,,
494000,Audio,19. Accesorio Audio,/494000_TK-150.png,EV,TK-150,Transformador de linea 150w 70v,Si desea convertir su altavoz EVC  en un sistema para audio distribuido en donde se puedan colocar muchos en un mismo canal debe de instalar este transformador internamente,,Altavoz serie EVC,,,,,,,1,1,,,,,1,1,1,1,,,,,,,,,,,,,,,,,,,,,,,,1,1,1,1,1,,,,,,,,,,,,,,,
495000,Audio,19. Accesorio Audio,/495000_IP-10B-T.png,EV,IP-10B-T,Transformador de linea 250w 70v,"Si desea convertir su bajo S10,1D  en un sistema para audio distribuido en donde se puedan colocar muchos en un mismo canal debe de instalar este transformador internamente",,"Subwoofer Evid S10,1D",,,,,,1,1,1,1,1,1,1,1,,,1,,,,1,1,1,1,1,1,1,1,1,1,1,,1,1,1,1,1,1,1,1,1,1,1,1,1,1,1,1,,,1,1,1,1,1,1,1,,,
496000,Audio,19. Accesorio Audio,/496000_UB-10D.png,EV,UB-10D,Soporte de pared o techo,"Si desea instalar su bajo S10,1D ya sea en una pared o en un techo para que sea esteticamente mas placentero use este soporte ecualizable",,"Subwoofer Evid S10,1D",,,,,,1,1,1,1,1,1,1,1,,,1,,,,1,1,1,1,1,1,1,1,1,1,1,,1,1,1,1,1,1,1,1,1,1,1,1,1,1,1,1,,,1,1,1,1,1,1,1,,,
496500,Audio,19. Accesorio Audio,/Fotos2024_4/ARC-Pse RTP.png,Symetrix,ARC-Pse,Distribuidor de potencia para wall panels ARC,Cuando tenga multiples paneles ARC y la mejor forma de distribuir la potencia para optimziar cableado sea atravez de forma de estrella,,Paneles ARC,,,,,,1,1,1,1,1,,,,,,,,,,,,,,,,,,1,1,1,,,,,,,,,,,,1,,1,,,,,,,,,1,1,1,,,,
496510,Audio,19. Accesorio Audio,/Fotos2024_4/xControl RTP.png,Symetrix,xControl,Expansor de controles seriales y logicos,Si esta usando la matrix de Symetrix como un controlador de automatizacion y requeire mas entradas y salidas logicas y puerto RS232,,Radius NX o Prism,,,,,,1,1,1,1,1,,,,,,,,,,,,,,,,,,1,1,1,,,,,,,,,,,,1,,1,,,,,,,,,1,1,1,,,,
496520,Audio,19. Accesorio Audio,/Fotos2024_4/Control Server RTP.png,Symetrix,Control Server,Plataforma para control AV extendido,Si esta usando la matrix de Symetrix como un controlador de automatizacion en un proyecto de cierta magnitud es recomendable usar este equipo para una mas facil administracion de los multiples endpoints usados,,Radius NX o Prism,,,,,,1,1,1,1,1,,,,,,,,,,,,,,,,,,1,1,1,,,,,,,,,,,,1,,1,,,,,,,,,1,1,1,,,,
497000,Audio,19. Accesorio Audio,/VC-3xxx Audac RTP.png,Audac,VC-3036,Atenuador Volumen 36w,Si requiere controlar el volumen remotamente para zonas de maximo 36w,,,,,WB-3102,,,,,,,,1,,,,,,,,,,,,,1,1,,1,1,,,,,,,,1,,,,,,,,,,1,,1,1,,1,,,,,1,,,
498000,Audio,19. Accesorio Audio,/VC-3xxx Audac RTP.png,Audac,VC-3062,Atenuador Volumen 60w,Si requeire controlar el volumen remotamente para zonas de maximo 60w,,,,,WB-3102,,,,,,,,1,,,,,,,,,,,,,1,1,,1,1,,,,,,,,1,,,,,,,,,,1,,1,1,,1,,,,,1,,,
499000,Audio,19. Accesorio Audio,/VC-3xxx Audac RTP.png,Audac,VC-3102,Atenuador Volumen 100w,Si requeire controlar el volumen remotamente para zonas de maximo 100w,,,,,WB-3102,,,,,,,,1,,,,,,,,,,,,,1,1,,1,1,,,,,,,,1,,,,,,,,,,1,,1,1,,1,,,,,1,,,
499500,Audio,19. Accesorio Audio,/XVC-C60 RTP.png,DreamSound,XVC-C60,Atenuador Volumen 60w,Si requeire controlar el volumen remotamente para zonas de maximo 60w,,,,,Si,,,,,,,,1,,,,,,,,,,,,,1,1,,1,1,,,,,,,,1,,,,,,,,,,1,,1,1,,1,,,,,1,,,
499505,Audio,19. Accesorio Audio,/XVC-C120 RTP.png,DreamSound,XVC-C120,Atenuador Volumen 120w,Si requeire controlar el volumen remotamente para zonas de maximo 120w,,,,,Si,,,,,,,,1,,,,,,,,,,,,,1,1,,1,1,,,,,,,,1,,,,,,,,,,1,,1,1,,1,,,,,1,,,
499510,Audio,19. Accesorio Audio,/TF7010030A RTP.png,DreamSound,TF70100-30A,Transformador de linea 30wts 70v/100v,Cuando requiera a un altavoz de 8 ohms convertirlo en 70v/100v para poder conectar muchos en paralelo use este transforamdo,,,,,Si,,,,,,,,1,,,,,,,,,,,,,1,1,,1,1,,,,,,,,1,,,,,,,,,,1,,1,1,,1,,,,,1,,,
500000,Audio,19. Accesorio Audio,/500000_PVA-1EB.png,Bosch,PVA-1EB,Tapa de seguridad para boton emergencias,Si prefiere que el boton para lanzar emergencias en la estacion de llamadas Paviro este protegido use este accesorio,1,PVA-15CST,,,,,,,,,,1,,,,,,,,,,,,,,,1,1,1,1,1,1,,,,1,1,,,,,,,,1,1,,1,1,,1,1,1,1,1,1,,1,1,,
501000,Audio,19. Accesorio Audio,/501000_PVA-1KS.png,Bosch,PVA-1KS,Llave de seguridad para estacion de llamados,Si prefiere que la  estacion de llamadas este protegida por llave para su uso utilice este accesorio,1,PVA-15CST,,,,,,,,,,1,,,,,,,,,,,,,,,1,1,1,1,1,1,,,,1,1,,,,,,,,1,1,,1,1,,1,1,1,1,1,1,,1,1,,
502000,Audio,19. Accesorio Audio,/502000_PRA-ESP8.png,Bosch,PRA-ESP8,Switch Ethernet PoE 8 puertos,Interconecte los equipos con un switch garantizado para el transporte seguro y bajo normatividad del audio para evacuacion Praesensa,1,,,,,,,,,,,1,,,,,,,,,,,,,,,1,1,1,1,1,1,,,,1,1,,,,,,,,1,1,,1,1,,1,1,1,1,1,1,1,1,1,,
503000,Video,21. Camaras,/Fotos2024_4/MZC-F22UV3 RTP.png,iSmart,MZC-F22UV3,Webcam ePTZ 4K Zoom digital 8x de 120° Autoframing USB,Si requeire captar una mesa de 4 a 6 personas y que la camara enfoque automaticamente a medida que entren y salgan personas,,,,,,1,1,,,,,,,,,,,,,,,,,,,,,,,,,,1,,,,,,,,,,,,,,,,,,,,,,,,,,,,
503010,Video,21. Camaras,/Fotos2024_4/AMC-M1001-V3 RTP.png,iSmart,AMC-M1001-V3,Camara PTZ 1080p Zoom optico 10x de 72° USB y HDMI,Cuando necesite una camara PTZ con zoom optico a muy buen precio,,,,,,,1,,1,1,1,,,,,,,,,,,,,,,,,,,,,,1,1,,,,,1,1,,,,,,,,,,,,,,,,,,,,,
503020,Video,21. Camaras,/Fotos2024_4/AMC-E200NV3 RTP.png,iSmart,AMC-E200NV3,Camara PTZ 1080p Zoom optico 12x de 72° USB y HDMI,Cuando necesite una camara PTZ con zoom optico profesional,,,,,,,,,1,1,1,,,,,,,,,,,,,,,,,,,,,,1,1,,,,,,,,,,,,,,,,,,,,,,,,,,,
503030,Video,21. Camaras,/Fotos2024_4/AMC-G309N RTP.png,iSmart,AMC-G309N,"Barra Webcam ePTZ 4K Zoom optico 4x de 110° Autoframing, mics beamforming y 20wts",Cuando necesite una solucion todo en uno que enfoque automaticamente a las personas incluyendo microfonos y altavoces para un espacio de 5 a 10 personas,,,,,,,1,,,,,,,,,,,,,,,,,,,,,,,,,,,1,,,,,,,,,,,,,,,,,,,,,,,,,,,
503040,Video,21. Camaras,/Fotos2024_4/AMC-G320 RTP.png,iSmart,AMC-G320,Camara PTZ 1080p Zoom optico 20x de 59° USB y HDMI - ONVIF,Cuando necesite una camara PTZ con zoom optico profesional con protocolo ONVIF,,,,,,,1,1,1,1,1,,,,,,,1,,,,,,,,,,,,,,,,1,,,,,,,1,1,1,1,,,,,,,,,,,,,,,,,
503050,Video,21. Camaras,/Fotos2024_4/AMC-NE220-NV3 RTP.png,iSmart,AMC-NE220-NV3,"Camara PTZ 1080p Zoom optico 20x de 59° transporte IP por NDI, USB y HDMI",Cuando necesite una camara PTZ con zoom optico profesional y transporte de señal por la red IP en protocolo NDI,,,,,,,,,,1,1,,,,,,,1,,,,,,,,,,,,,,,,1,,,,,,,,,,1,,,,,,,,,,,,,,,,,
503060,Video,21. Camaras,/Fotos2024_4/LTC5A-2001N RTP.png,iSmart,LTC5A-2001N,"Camara PTZ 1080p Zoom optico 20x de 59° Autotracking, USB, HDMI",Cuando necesite una camara PTZ con zoom optico profesional y que le haga seguimiento al expositor a medida que se desplaze,,,,,,,,1,1,1,,,,,,,,,,,,,,,,,,,,,,,1,1,,,,,,1,,,,,,,,,,,,,,,,,,,,,
503070,Video,21. Camaras,/Fotos2024_4/LTC2A-2001N-V2 RTP.png,iSmart,LTC2A-2001N-V2,"Camara PTZ 1080p Zoom optico 20x de 59° Autotracking, doble camara, USB, HDMI",Cuando necesite una camara PTZ con zoom optico profesional y que le haga seguimiento al expositor a medida que se desplaze y pueda presentar 2 imágenes simultaneas.  Esta segunda camara ayuda tambien apra un mejor enfoque y seguimiento mas fluido,,,,,,,,,1,1,,,,,,,,,,,,,,,,,,,,,,,1,1,,,,,,,1,1,1,,,,,,,,,,,,,,,,,,
503080,Video,21. Camaras,/Fotos2024_4/AMC-G200TH-V2 RTP.png,iSmart,AMC-G200TH-V2,"Camara PTZ 1080p Zoom optico 120x de 98° Autoframing y seguimiento por voz, autoframing, doble camara PiP, USB y HDMI",Cuando necesite una camara PTZ con zoom optico profesional y que le haga seguimiento al expositor a medida que se desplaze o tambien haga enfoque automatico a personas en la mesa a medida que vayan sentandose y pueda presentar 2 imágenes simultaneas.  Esta segunda camara ayuda tambien apra un mejor enfoque y seguimiento mas fluido,,,,,,,,1,1,1,,,,,,,,1,,,,,,,,,,,,,,,1,1,,,,,,,,1,1,,,,,,,,,,,,,,,,,,
504000,Video,21. Camaras,/Fotos2024_4/Unite-10 RTP.png,ClearOne,Unite-10,Webcam PTZ 1080p Zoode 90° USB,Si requeire una camara sencilla pero de buena imagen profesional,,,,,,1,,,,,,,,,,,,,,,,,,,,,,,,,,,,,,,,,,,,,,,,,,,,,,,,,,,,,,,
504020,Video,21. Camaras,/Fotos2024_4/Unite-180 RTP.png,ClearOne,Unite-180,Webcam ePTZ 4K Zoom digital 4xx de 180° Autoframing con vistas Panoramica o en grilla,Si requeire una camara confiable que enfoque a las personas a medida que se vayan sentando en la mesa y que entregue imágenes ya sean panoramicas o recuadros de cada uno de los participantes,,,,,,,1,1,1,1,,,,,,,,,,,,,,,,,,,,,,,1,,,,,,,,,,,,,,,,,,,,,,,,,,,,
504030,Video,21. Camaras,/Fotos2024_4/Unite-260 Pro RTP.png,ClearOne,Unite-260 Pro,"Camara PTZ 42 Zoom optico 10x de 60° Autoframing, USB, HDMI",Cuando necesite una camara muy confiable PTZ con zoom optico profesional y que enfoque a las personas en la mesa a medida que se vayan sentando,,,,,,,,1,1,1,1,,,,,,,1,,,,,,,,,,,,,,,1,1,,,,,,,,1,1,,,,,,,,,,,,,,,,,,
508000,Video,21. Camaras,/508000_SRG-300SE.png,Sony,SRG-A12 o 40,Camara para instalacion fija con seguimiento (en color blanco o negro) 12x o 40x,"Si usted requiere captar con calidad profesional en niveles para ser usados en transmisiones de TV publica va a necesitar esta camara PTZ con gran rango de movimiento y posibilidad de instalacion en paredes o techos sin que moleste a la estetica.  Esta version tiene la posibilidad de hacer autotracking y autoframing con inteligencia artificial, es decir, seguir a la persona que se le indique es el centro del evento.",,,,,,,,,1,1,,,,,,,,1,,,,,,,,,,,,,,,,,,,,,,,,,1,,,,,,,,,,,,,,,,,,
510000,Video,23. Videoconferencia,/510000_Versa Hub.png,ClearOne,Versa Hub,Hub central de conexión de dispositivos,"Para facilitar la conexión de la camara, el PC y el audio de un salon equipado para videoconferencia de manera que sea mas agil y cumpla mejor la funcion de llevar su propio dispositivo",,,,,,1,1,1,,,,,,,,,,,,,,,,,,,,,,,,,,,,,,,,,,,,,,,,,,,,,,,,,,,,,
510010,Video,23. Videoconferencia,/USC2100TX RX RTP.png,ClearOne,Versa USC2100TX,Transmisor Hub de conexión de dispositivos,Complemente su sala con un sistema que le permite no solo transportar las señales mas seguramente sino tambien suichear y enrutar apopiadamente,,USC2100RX,,,,,,1,1,,,,,,,,,,,,,,,,,,,,,,,,,1,,,,,,,,,,,,,,,,,,,,,,,,,,,
510015,Video,23. Videoconferencia,/USC2100TX RX RTP.png,ClearOne,Versa USC2100RX,Receptor Hub de conexión de dispositivos,Complemente su sala con un sistema que le permite no solo transportar las señales mas seguramente sino tambien suichear y enrutar apopiadamente,,USC2100TX,,,,,,1,1,,,,,,,,,,,,,,,,,,,,,,,,,1,,,,,,,,,,,,,,,,,,,,,,,,,,,
510025,Video,23. Videoconferencia,/USB22D RTP.png,ClearOne,USB22D,Conversor de Dante a USB bidireccional,Cuando necesite tomar una señal dante y conectarla a un PC con Zoom/Teams  y asi pueda tenr videoconferencia,,,,,,,1,1,1,1,1,,,,,,,,,,,,,,,,,,,,,,1,1,,,,,,1,1,1,,1,,,,,,,,,,,,,,,,,
511000,Video,23. Videoconferencia,/Mersive Pod.png,Mersive,Pod3,Hub central inalambrico de conexión de dispositivos,"Si desea conectar muchos dispositivos (PC, Tablets, Smartphones) a un sistema de vodeoconferencias o proyeccion inalambricamente y ademas tener 6 salones adicionales de la manera mas agil posible",,,,,,,1,1,1,1,1,1,,,,,,1,1,,,,,,,,,,,,1,,,1,,,,,,,,1,1,,,,1,,,,,,,,,,,,,,
511050,Video,23. Videoconferencia,/Fotos2024_4/SHARE2U RTP.png,Inogeni,SHARE2U,Mixer de 2 camaras USB + 2 HDMI PiP a USB y HDMI,"Cuando en una sala tenga mas de 1 camara y 1 fuente de contenido y quiera ahcer una produccion profesional seleccionando las tomas mas adecuadas y colocando imágenes PiP, al lado o suicheadas",,,,,,,,1,1,1,1,,,,,,,,,,,,,,,,,,,,,,1,1,,,,,,,,,,,,,,,,,,,,,,,,,,,
511060,Video,23. Videoconferencia,/Fotos2024_4/CAM230 RTP.png,Inogeni,CAM230,Switch de 2 camaras USB + 1 HDMI a saldia USB o HDMI,Si  desea seleccionar facilmente entre varias camaras USB y un contenido que tenga en el sitio ya sea manual o atravez de un sistema de automatizacion,,,,,,,1,1,1,1,,,,,,,,,,,,,,,,,,,,,,,1,1,,,,,,,,,,,,,,,,,,,,,,,,,,,
511070,Video,23. Videoconferencia,/Fotos2024_4/TOGGLE RTP.png,Inogeni,TOGGLE,Combinador de perifericos USB a 2 PC,"Cuando su sala este equipado con un computador fijo y unos perifericos (camaras, altavoces, microfonos) pre-establecidos, pero quiera permitir la flexibilidad que si alguien llega con un portatil con otro aplicativo de videoconferencias diferentes, muy facilmetne pueda enrutar todas las señales y convertir su laptop en el centro generado de la videoconferencia.  Muy util para salas pre establecidas para Zoom o Teams pero qeu quieran dejar la posibilidad que se puedan hacer videoconferencias con otros softcodecs como Webex, Meet, etc.",,,,,,,,1,1,1,1,,,,,,,,,,,,,,,,,,,,,,,1,,,,,,,,,,,,,,,,,,,,,,,,,,,
511080,Video,23. Videoconferencia,/Toggle Rooms RTP.png,Inogeni,TOGGLE Rooms,Combinador de perifericos USB y HDMI  Avanzado a 2 PC,"Cuando tenga un salon equipado con un sistema de videoconferencias de Lenovo, Crestron, Poly, MAXHUB, Logitech, o Jabra y requeira que agilmetne se integre a un PC Portatil que lleve alguien para realizar BYOD/BYOM y aprovechar todos los perifericos del salon.  Haga de su espacio de videoconferencias realmente un lugar de comunicacion unificada con todo el mundo",,,,,,,1,1,1,1,1,,,,,,,,,,,,,,,,,,,,,,1,1,,,,,,,,,,,,,,,,,,,,,,,,,,,
511100,Video,24. Matrix Video,/Fotos2024_4/EMCE-E200 RTP.png,Hall Tech,EMCE-E200,Switche de presentacion multioviewer,"Cuando desee equipar su sala con un sistema de produccion agil de manera que pueda manejar varias fuentes de entrada y enviarla a varias salidas con funcion de multiview, es decir ver varais imágenes de manera simultaneas.",,,,,,,,1,1,1,1,,,,,,,,,,,,,,,,,,,,,,1,,,,,,,,,,,,,,,,,,,,,,,,,,,,
512000,Video,24. Matrix Video,/Fotos2024_4/DL-S42-H2 RTP.png,Liberty,DL-S42-H2,Matrix HDMI 4x2,"Tome 4 señales de HDMI sean cámaras o PCs y envíelas a 2 dispositivos con HDMI como pantallas, proyectores o dispositivos de grabación",,,,,,,1,1,1,1,,,1,1,1,1,1,1,,,,,,,1,,,,,,,,,,,,,,,,,1,1,1,1,1,,,,,,,,,,,,,,,
512005,Video,24. Matrix Video,/Fotos2024_4/DL-HDM44A-H2 RTP.png,Liberty,DL-HDM44A-H2,Matrix HDMI 4x4,"Tome 4 señales de HDMI sean cámaras o PCs y envíelas a 4 dispositivos con HDMI como pantallas, proyectores o dispositivos de grabación",,,,,,,,1,1,1,,,1,1,1,1,1,1,,,,,,1,1,,,,,,,,,,,,,,,,,1,1,1,1,1,,,,,,,,,,,,,,,
512010,Video,24. Matrix Video,/Fotos2024_4/DL-HDM88A-H2 RTP.png,Liberty,DL-HDM88A-H2,Matrix HDMI 8x8,"Tome 8 señales de HDMI sean cámaras o PCs y envíelas a 8 dispositivos con HDMI como pantallas, proyectores o dispositivos de grabación",,,,,,,,1,1,1,1,,1,1,1,1,1,1,1,,,,,,,,,,,,,,,,,,,,,,,1,1,1,1,1,,,,,,,,,,,,,,,
512030,Video,24. Matrix Video,/Fotos2024_4/IPEX-1001 RTP.png,Liberty,IPEX-1001,Matrix por IP Encoder 1Gb,Cuando quiera tomar una señal 1080p (desde una fuente) y tenga la flexibilidad mayor que da una matrix virtual que pueda crecer cuando quiera a travez de la red a un precio muy competitivo,,,,,,,,,,,,1,1,1,1,1,1,1,1,,,,,1,1,1,1,1,1,1,1,1,,,,1,1,1,,,,1,1,1,1,1,,1,1,,,1,1,1,1,1,1,1,1,,
512040,Video,24. Matrix Video,/Fotos2024_4/IPEX-1002 RTP.png,Liberty,IPEX-1002,Matrix por IP Decoder 1Gb,Cuando quiera recibir una señal 1080p (hacia el display) y tenga la flexibilidad mayor que da una matrix virtual que pueda crecer cuando quiera a travez de la red a un precio muy competitvo,,,,,,,,,,,,1,1,1,1,1,1,1,1,,,,,1,1,1,1,1,1,1,1,1,,,,1,1,1,,,,1,1,1,1,1,,1,1,,,1,1,1,1,1,1,1,1,,
512070,Video,24. Matrix Video,/Fotos2024_4/IPEX-2201 RTP.png,Liberty,IPEX-2201,Matrix por IP Encoder 1080p con funcion videowall 1Gb,Cuando quiera tomar una señal 1080p (desde una fuente) y tenga la flexibilidad mayor que da una matrix virtual con posibilidad de VIDEOWALL y que pueda crecer cuando quiera a travez de la red a un precio muy competitivo,,IPEXAR-2100,,,,,,,,,,1,1,1,1,1,1,1,1,,,,,1,1,,1,1,1,1,1,1,,,,,1,1,,,,1,1,1,1,1,,,,,,,,1,1,1,1,,1,,
512080,Video,24. Matrix Video,/Fotos2024_4/IPEX-2202 RTP.png,Liberty,IPEX-2202,Matrix por IP Decoder 1080p con funcion videowall 1Gb,Cuando quiera recibir una señal 1080p (hacia el display) con posibilidad de VIDEOWALL y que tenga la flexibilidad mayor que da una matrix virtual que pueda crecer cuando quiera a travez de la red a un precio muy competitvo,,IPEXAR-2100,,,,,,,,,,1,1,1,1,1,1,1,1,,,,,1,1,,1,1,1,1,1,1,,,,,1,1,,,,1,1,1,1,1,,,,,,,,1,1,1,1,,1,,
512090,Video,24. Matrix Video,/Fotos2024_4/IPEXAR-2100 RTP.png,Liberty,IPEXAR-2100,Controlador para serie 2000 1Gb,Este usando codificadores y decodificadores de la serie IPX2000,,Licencia Arranger basic,,,,,,,,,,1,1,1,1,1,1,1,1,,,,,1,1,,1,1,1,1,1,1,,,,,1,1,,,,1,1,1,1,1,,,,,,,,1,1,1,1,,1,,
513050,Video,24. Matrix Video,/Fotos2024_4/IPEX-5001 RTP.png,Liberty,IPEX-5001,Matrix por IP Encoder 4K con funcion videowall 1Gb,Cuando quiera tomar una señal 4K (desde una fuente) y tenga la flexibilidad mayor que da una matrix virtual con posibilidad de VIDEOWALL y que pueda crecer cuando quiera a travez de la red a un precio competitivo,,IPEXAR-5000,,,,,,1,1,1,1,,,,,,,1,1,,,,,1,,,,,,,,,,,,,,,,,,1,1,1,1,1,,,,,,,,,,,,,,,
513060,Video,24. Matrix Video,/Fotos2024_4/IPEX-5001-D RTP.png,Liberty,IPEX-5001-D,Matrix por IP Encoder 4K con funcion videowall + Audio Dante 1Gb,Cuando quiera tomar una señal 4K + Audio Dante (desde una fuente) y tenga la flexibilidad mayor que da una matrix virtual con posibilidad de VIDEOWALL y que pueda crecer cuando quiera a travez de la red a un precio competitivo,,IPEXAR-5000,,,,,,1,1,1,1,,,,,,,1,1,,,,,,,,,,,,,,,,,,,,,,,,,,,,,,,,,,,,,,,,,,
513070,Video,24. Matrix Video,/Fotos2024_4/IPEX-5001 RTP.png,Liberty,IPEX-5001,Matrix por IP Wall Plate Encoder 4K con funcion videowall 1Gb,Cuando quiera desde un WALL-PLATE una señal 4K (desde una fuente) y tenga la flexibilidad mayor que da una matrix virtual con posibilidad de VIDEOWALL y que pueda crecer cuando quiera a travez de la red a un precio competitivo,,IPEXAR-5000,,,,,,1,1,1,1,,,,,,,1,1,,,,,,,,,,,,,,,,,,,,,,,,,,,,,,,,,,,,,,,,,,
513080,Video,24. Matrix Video,/Fotos2024_4/IPEX-5002 RTP.png,Liberty,IPEX-5002,Matrix por IP Decoder 4K con funcion videowall 1Gb,Cuando quiera recibir una señal 4K (hacia el display) con posibilidad de VIDEOWALL y que tenga la flexibilidad mayor que da una matrix virtual que pueda crecer cuando quiera a travez de la red a un precio competitvo,,IPEXAR-5000,,,,,,1,1,1,1,,,,,,,1,1,,,,,,,,,,,,,,,,,,,,,,,,,,,,,,,,,,,,,,,,,,
513090,Video,24. Matrix Video,/Fotos2024_4/IPEXAR-5000 RTP.png,Liberty,IPEXAR-5000,Controlador para serie 5000 1Gb,Este usando codificadores y decodificadores de la serie IPX5000,,Licencia Arranger basic,,,,,,1,1,1,1,,,,,,,1,1,,,,,,,,,,,,,,,,,,,,,,,,,,,,,,,,,,,,,,,,,,
513110,Video,24. Matrix Video,/Fotos2024_4/IPEX-5101 RTP.png,Liberty,IPEX-5101,Matrix por IP Encoder 4K + Audio Dante 1Gb,Cuando quiera tomar una señal 4K + Audio Dante (desde una fuente) y tenga la flexibilidad mayor que da una matrix virtual con posibilidad de VIDEOWALL y que pueda crecer cuando quiera a travez de la red,,,,,,,,,,,,1,1,1,1,1,1,1,1,,,,,,1,,1,1,1,1,1,1,,,,,1,,,,,1,1,1,1,1,,,,,,,,,1,1,1,,1,,
513120,Video,24. Matrix Video,/Fotos2024_4/IPEX-5101UD-WP RTP.png,Liberty,IPEX-5101UD-WP,Matrix por IP Wall Plate Encoder 4K + Audio Dante 1Gb,Cuando quiera desde un WALL-PLATE una señal 4K + Audio Dante (desde una fuente) y tenga la flexibilidad mayor que da una matrix virtual con posibilidad de VIDEOWALL y que pueda crecer cuando quiera a travez de la red,,,,,,,,,,,,1,1,1,1,1,1,1,1,,,,,,1,,1,1,1,1,1,1,,,,,1,,,,,1,1,1,1,1,,,,,,,,,1,1,1,,1,,
513130,Video,24. Matrix Video,/Fotos2024_4/IPEX-5102 RTP.png,Liberty,IPEX-5102,Matrix por IP Decoder 4K + Audio Dante 1Gb,Cuando quiera recibir una señal 4K + Audio Dante (hacia el display) con posibilidad de VIDEOWALL y que tenga la flexibilidad mayor que da una matrix virtual que pueda crecer cuando quiera a travez de la red,,IPEXAR-5000,,,,,,,,,,1,1,1,1,1,1,1,1,,,,,,1,,1,1,1,1,1,1,,,,,1,,,,,1,1,1,1,1,,,,,,,,,1,1,1,,1,,
513150,Video,24. Matrix Video,/Fotos2024_4/IPEX-6000TC-C RTP.png,Liberty,IPEX-6000TC-C,Matrix por IP Transiver 4K SDVoE con funcion videowall sin latencia 10Gb,Si desea tener la flexibilidad que da una matrix virtual con posibilidad de hasta videowall y transportar señales 4K sin compresion ni latencia este equipo que le sirve tanto para transmitir como para recibir a travez de una red IP 10Gb por cable UTP le permitira crecer y configurarla como lo desee,,IPEXAR-6000,,,,,,1,1,1,1,,,,,,,1,,,,,,,,,,,,,,,,,,,,,,,,,1,,,1,,,,,,,,,,,,,,,
513160,Video,24. Matrix Video,/Fotos2024_4/IPEX-6000TC-F RTP.png,Liberty,IPEX-6000TC-F,"Matrix por IP Transiver 4K SDVoE con funcion videowall sin latencia, transmision por fibra optica 10Gb",Si desea tener la flexibilidad que da una matrix virtual con posibilidad de hasta videowall y transportar señales 4K sin compresion ni latencia este equipo que le sirve tanto para transmitir como para recibir a travez de una red IP 10Gb por FIBRA OPTICA le permitira crecer y configurarla como lo desee,,IPEXAR-6000,,,,,,1,1,1,1,1,,,,,,1,1,,,,,,,,,1,,1,,1,,,,,1,,,,,,1,,,1,,,1,,,,1,,1,1,1,1,1,,
513170,Video,24. Matrix Video,/Fotos2024_4/IPEX-6001U-WP RTP.png,Liberty,IPEX-6001U-WP,Matrix por IP Wall Plate Encoder 4K SDVoE con funcion videowall sin latencia 10Gb,Cuando quiera transmitir desde un WALL-PLATE una señal 4K SIN COMPRESION NI LATENCIA (desde una fuente) y tenga la flexibilidad mayor que da una matrix virtual con posibilidad de VIDEOWALL y que ademas pueda crecer cuando quiera a travez de una red 10Gb,,IPEXAR-6000,,,,,,1,1,1,1,,,,,,,1,,,,,,,,,,,,,,,,,,,,,,,,,1,,,1,,,,,,,,,,,,,,,
513180,Video,24. Matrix Video,/Fotos2024_4/IPEX-6002U-WP RTP.png,Liberty,IPEX-6002U-WP,Matrix por IP Wall Plate Decoder 4K SDVoE con funcion videowall sin latencia 10Gb,Cuando quiera desde un WALL-PLATE recibir una señal 4K SIN COMPRESION NI LATENCIA (hacia el display) y tenga la flexibilidad mayor que da una matrix virtual con posibilidad de VIDEOWALL y que ademas pueda crecer cuando quiera a travez de una red 10Gb,,IPEXAR-6000,,,,,,1,1,1,1,,,,,,,1,,,,,,,,,,,,,,,,,,,,,,,,,1,,,1,,,,,,,,,,,,,,,
520000,Video,24. Matrix Video,/520000_AC-CX42.png,AV Pro Edge,AC-CX42,Matrix 4x2 HDMI con HDBaseT y extractor audio,"Si requiere tomar el audio y el video de 4 fuentes reproductoras de HDMI y enrutarlas a 2 displays de HDMI, incluye un puerto HdBaseT si una señal esta a mas larga distancia",,,,,,,,1,1,1,1,1,,,,,,1,1,,,,,,,,,,,,1,,,1,,,,,,,,,1,,,,,,,,,,,,,,,,,,
521000,Video,24. Matrix Video,/521000_AC-MX44.png,AV Pro Edge,AC-MX44,Matrix 4x4 HDMI con extractor de audio 4K,Si requiere tomar el audio y el video de 4 fuentes reproductoras de HDMI y enrutarlas a 4 displays de HDMI y extraer el audio para equipos de amplificacion externos,,,,,,,,1,1,1,1,1,,,,,,1,1,,,,,,,,,,,,1,,,,,,,,,,,,1,,,,,,,,,,,,,,,,,,
522000,Video,24. Matrix Video,/522000_AC-MX88.png,AV Pro Edge,AC-MX88,Matrix 8x8 HDMI con extractor de audio 4K,Si requiere tomar el audio y el video de 4 fuentes reproductoras de HDMI y enrutarlas a 4 displays de HDMI y extraer el audio para equipos de amplificacion externos,,,,,,,,1,1,1,1,1,,,,,,1,1,,,,,,,,,,,,1,,,,,,,,,,,,1,,,,,,,,,,,,,,,,,,
523000,Video,24. Matrix Video,/523000_VideoFlux.png,AV Pro Edge,VideoFlux,"Matrix 4x2 con scaler, estractor de audio y multiview 4K","Cuando requiero tomar señales VGA, Componenetes y HDMI y enrutarlas para presentarse en 2 display con extractor de audio pero a su vez dividir la imagen para tener una visualizacion de varias de manera simultanea",,,,,,,,1,1,1,1,1,,,,,,1,1,,,,,,,,,,,,1,,,,,,,,,,,,1,,,,,,,,,,,,,,,,,,
